sessao_id,data,sessao,autor,comentario,fala,link
9995,2021-05-18,9, Otto Alencar,PSD - BA. Para interpelar.,"O Ministro Ernesto Araújo disse que o Brasil foi o primeiro país a participar da reunião do consórcio Covax Facility. Em abril, foi a primeira reunião, não tinha um representante do Brasil nem da diplomacia do Brasil naquela reunião. A outra reunião foi em maio, liderada pela Espanha, pela França, pelos países árabes, e não tinha um representante do Brasil. Só tomou iniciativa em junho. Então, o Ministro faltou com a verdade. Ele não falou aquilo que realmente aconteceu. Ministro, em abril, na primeira reunião do consórcio, não tinha um representante da diplomacia brasileira – nem em abril, nem em maio. O Ministério das Relações Exteriores se manifestou em junho. Então, é completamente descabida a colocação que V. Sa. fez.",https://www25.senado.leg.br/web/atividade/notas-taquigraficas/-/notas/r/9995
9995,2021-05-18,9, Otto Alencar,PSD - BA. Para interpelar.,"Em segundo lugar, chegou ao ponto, por vacina, de o Congresso Nacional se manifestar. O Presidente do Senado Federal, Rodrigo Pacheco, apelou, com a Senadora Kátia, para que os Estados Unidos socorressem o Brasil. O Presidente Rodrigo Pacheco fez uma carta à Vice-Presidente americana, Kamala Harris, para pedir vacina, e não foi atendido. Não é possível que nós estejamos já no mês de maio... Vacinaram-se da primeira e da segunda dose nem 10%, e o Brasil é o país que mais vacina. O Brasil tem, o País tem uma capacidade de rede básica instalada em todos os Estados para vacinar até 2 milhões de pessoas por dia, mas falta vacina. Está faltando vacina, isso é óbvio. Quem diz o contrário não está falando a verdade, ou melhor, está brigando com a verdade. Essa é a grande realidade.",https://www25.senado.leg.br/web/atividade/notas-taquigraficas/-/notas/r/9995
9995,2021-05-18,9, Otto Alencar,PSD - BA. Para interpelar.,"Portanto, eu queria perguntar ao Ministro se ele realmente concordava ou concorda ainda com mais de 15 declarações do Presidente da República dizendo que não ia comprar a vacina. Estão aqui no meu celular. Se quiser, eu boto, ao vivo, o Presidente Bolsonaro dizendo, em agosto, setembro, outubro, novembro, que não ia comprar vacina. Chegou ao ponto de dizer que alguém que tomasse vacina ia virar jacaré, lá em Porto Seguro. ""Eu sou o Presidente e eu mando."" V. Sa. era muito alinhado com a política do Presidente. Na área de saúde, eu queria perguntar se, naquele tempo em que o Presidente falava isso, V. Exa. concordava que ia virar jacaré, que não ia comprar vacina, que, enquanto ele fosse Presidente, não ia comprar? O senhor tomou alguma decisão nesse sentido, já que o senhor defende a vacinação como estava fazendo agora aqui? Concorda com o Presidente ou discorda dele? Aqui estão – se eu quiser, posso refrescar a sua memória – 15 declarações do Presidente contra a vacina. O senhor concorda com o que ele dizia no ano passado e no começo deste ano?",https://www25.senado.leg.br/web/atividade/notas-taquigraficas/-/notas/r/9995
9995,2021-05-18,9, Ernesto Araújo,Para depor.,"– Obrigado, Senador.",https://www25.senado.leg.br/web/atividade/notas-taquigraficas/-/notas/r/9995
9995,2021-05-18,9, Ernesto Araújo,Para depor.,"Eu sempre determinei e o Itamaraty executou tudo o que foi necessário, tudo o que nos foi demandado para aquisição de vacinas. Jamais houve qualquer atitude...",https://www25.senado.leg.br/web/atividade/notas-taquigraficas/-/notas/r/9995
9995,2021-05-18,9, Otto Alencar,PSD - BA,"– Ministro, a pergunta é se concorda ou não concorda. Não foi isso que eu perguntei.",https://www25.senado.leg.br/web/atividade/notas-taquigraficas/-/notas/r/9995
9995,2021-05-18,9, Ernesto Araújo,PSD - BA,"– Senador, não cabe concordar ou discordar de uma declaração. Inclusive, se o Presidente declarou...",https://www25.senado.leg.br/web/atividade/notas-taquigraficas/-/notas/r/9995
9995,2021-05-18,9, Otto Alencar,PSD - BA,– É só dizer concordo com o Presidente ou não concordo. Eu pergunto a V. Exa.,https://www25.senado.leg.br/web/atividade/notas-taquigraficas/-/notas/r/9995
9995,2021-05-18,9, Otto Alencar,PSD - BA,"V. Exa. fez agora uma declaração como se fosse o maior defensor da vacina e não foi. V. Exa. brigou com a verdade. Fale a verdade. O que se exige de um chanceler é a verdade. Sabe por que, Ministro? Porque a Medicina – a Medicina – quer integralidade, honestidade, verdade sobre os fatos acontecidos.",https://www25.senado.leg.br/web/atividade/notas-taquigraficas/-/notas/r/9995
9995,2021-05-18,9, Otto Alencar,PSD - BA,"Estão ali, 436 mil mortos. Ministro, desses 436 mil mortos, 302 mil tinham mais de 60 anos e perderam a aposentadoria. Nas ruas, nas casas do Brasil, choram as viúvas, os órfãos da Covid-19, os avós que perderam os netos. Trezentos e dois mil ficaram sem aposentadoria.",https://www25.senado.leg.br/web/atividade/notas-taquigraficas/-/notas/r/9995
9995,2021-05-18,9, Otto Alencar,PSD - BA,"Se buscou vacina, como? O senhor faltou com a verdade. Só em junho se dirigiu ao Covax Facility, o consórcio. Só em junho, está aqui, eu posso provar, inclusive a imprensa já divulgou essa falta de honestidade de V. Sa.",https://www25.senado.leg.br/web/atividade/notas-taquigraficas/-/notas/r/9995
9995,2021-05-18,9, Otto Alencar,PSD - BA,"Então, mais, Ministro, o senhor era um grande defensor da política do Presidente Jair Bolsonaro.",https://www25.senado.leg.br/web/atividade/notas-taquigraficas/-/notas/r/9995
9995,2021-05-18,9, Otto Alencar,PSD - BA,"Depois que V. Exa. foi demitido, não sei se por merecimento, provavelmente por merecimento, V. Exa. começou a criticar o Governo Bolsonaro. Por exemplo, que termo é esse que o senhor usou aqui? Gato pardo, que termo é esse, Ministro? ""Leilões, privatizações, reforma tributária, administrativa, se não for combatida a essência do sistema essas reformas serão 'gatopardo'"".",https://www25.senado.leg.br/web/atividade/notas-taquigraficas/-/notas/r/9995
9995,2021-05-18,9, Otto Alencar,PSD - BA,Que termo é esse? É um termo que é usado pelos chanceleres de uma maneira geral? Porque me parece que isso aqui é um termo usado no meio de pessoas que usam de um linguajar completamente inadequado.,https://www25.senado.leg.br/web/atividade/notas-taquigraficas/-/notas/r/9995
9995,2021-05-18,9, Otto Alencar,PSD - BA,"O que é ""gatopardo""?",https://www25.senado.leg.br/web/atividade/notas-taquigraficas/-/notas/r/9995
9995,2021-05-18,9, Ernesto Araújo,PSD - BA,"– Obrigado, Senador.",https://www25.senado.leg.br/web/atividade/notas-taquigraficas/-/notas/r/9995
9995,2021-05-18,9, Ernesto Araújo,PSD - BA,"""Gatopardo"" é uma referência a um romance do escritor italiano Tomasi di Lampedusa.",https://www25.senado.leg.br/web/atividade/notas-taquigraficas/-/notas/r/9995
9995,2021-05-18,9, Ernesto Araújo,PSD - BA,Tem uma frase famosa no romance que diz que é preciso que tudo mude para que tudo continue como está.,https://www25.senado.leg.br/web/atividade/notas-taquigraficas/-/notas/r/9995
9995,2021-05-18,9, Otto Alencar,PSD - BA,– Mas o que o senhor está dizendo aqui é diferente.,https://www25.senado.leg.br/web/atividade/notas-taquigraficas/-/notas/r/9995
9995,2021-05-18,9, Otto Alencar,PSD - BA,"O ""gatopardo"" é a articulação política inadequada que queria mudar o Brasil e só a pressão popular pode mudar o Brasil. Então, é isso aqui que está escrito.",https://www25.senado.leg.br/web/atividade/notas-taquigraficas/-/notas/r/9995
9995,2021-05-18,9, Otto Alencar,PSD - BA,"Segundo, vou perguntar a V. Sa. também, que defende tanto o Governo.",https://www25.senado.leg.br/web/atividade/notas-taquigraficas/-/notas/r/9995
9995,2021-05-18,9, Otto Alencar,PSD - BA,"O Congresso em Foco: ""Ernesto Araújo diz que o Governo Bolsonaro é sem alma e sem ideal"".",https://www25.senado.leg.br/web/atividade/notas-taquigraficas/-/notas/r/9995
9995,2021-05-18,9, Otto Alencar,PSD - BA,"O senhor disse isso, está aqui escrito, no dia 1º de maio de 2021.",https://www25.senado.leg.br/web/atividade/notas-taquigraficas/-/notas/r/9995
9995,2021-05-18,9, Otto Alencar,PSD - BA,"O senhor é daquele tipo, sou isso ou aquilo conforme dois pontos? No Governo, defendo, fora do Governo, critico e bato? É isso que eu quero perguntar a V. Sa.",https://www25.senado.leg.br/web/atividade/notas-taquigraficas/-/notas/r/9995
9995,2021-05-18,9, Otto Alencar,PSD - BA,"Olhe bem, o senhor é do tipo, sou isso ou aquilo conforme dois pontos? Porque no Governo era só elogio, saiu do Governo, perdeu o cargo, está aqui. O senhor bate forte no Governo Bolsonaro, mas forte, mais do que até um independente como eu.",https://www25.senado.leg.br/web/atividade/notas-taquigraficas/-/notas/r/9995
9995,2021-05-18,9, Otto Alencar,PSD - BA,Por que o senhor mudou de posição?,https://www25.senado.leg.br/web/atividade/notas-taquigraficas/-/notas/r/9995
9995,2021-05-18,9, Ernesto Araújo,PSD - BA,– Perfeito.,https://www25.senado.leg.br/web/atividade/notas-taquigraficas/-/notas/r/9995
9995,2021-05-18,9, Otto Alencar,PSD - BA,"– Ou, então, seria aquela do filósofo baiano lá: ""Só não muda de opinião quem não as tem por interesse próprio"".",https://www25.senado.leg.br/web/atividade/notas-taquigraficas/-/notas/r/9995
9995,2021-05-18,9, Ernesto Araújo,PSD - BA,"– Obrigado, Senador.",https://www25.senado.leg.br/web/atividade/notas-taquigraficas/-/notas/r/9995
9995,2021-05-18,9, Ernesto Araújo,PSD - BA,"Enquanto estive no Governo, sempre acreditei no Governo como um projeto, como um novo projeto de País, como um novo projeto de Nação, com transformações profundas, procurei falar disso na minha introdução",https://www25.senado.leg.br/web/atividade/notas-taquigraficas/-/notas/r/9995
9995,2021-05-18,9, Ernesto Araújo,PSD - BA,"Não tenho propriamente uma crítica ao Governo como um todo, mas tenho uma crítica ao fato de que isso...",https://www25.senado.leg.br/web/atividade/notas-taquigraficas/-/notas/r/9995
9995,2021-05-18,9, Otto Alencar,PSD - BA,"– Mas isso aqui é verdade, o senhor disse isso, não é?",https://www25.senado.leg.br/web/atividade/notas-taquigraficas/-/notas/r/9995
9995,2021-05-18,9, Ernesto Araújo,PSD - BA,– É.,https://www25.senado.leg.br/web/atividade/notas-taquigraficas/-/notas/r/9995
9995,2021-05-18,9, Otto Alencar,PSD - BA,"– O senhor não pode negar, disse ou não disse?",https://www25.senado.leg.br/web/atividade/notas-taquigraficas/-/notas/r/9995
9995,2021-05-18,9, Ernesto Araújo,PSD - BA,"– É, que o Brasil... que o Governo foi perdendo a alma e o ideal, no sentido de que...",https://www25.senado.leg.br/web/atividade/notas-taquigraficas/-/notas/r/9995
9995,2021-05-18,9, Otto Alencar,PSD - BA,"– Perdendo a alma. Então, é o Governo desalmado. Não é isso?",https://www25.senado.leg.br/web/atividade/notas-taquigraficas/-/notas/r/9995
9995,2021-05-18,9, Ernesto Araújo,PSD - BA,"– Não, não é isso, não.",https://www25.senado.leg.br/web/atividade/notas-taquigraficas/-/notas/r/9995
9995,2021-05-18,9, Ernesto Araújo,PSD - BA,"O impulso de transformação do Governo parece que se desgastou, sobretudo ao longo do último ano. Eu acreditava muito nesse impulso, continuo acreditando que é um Governo que tem a capacidade de fazer, de implementar transformações no Brasil, profundas. Então, ao que eu quis me referir é que esse impulso transformador se desgastou.",https://www25.senado.leg.br/web/atividade/notas-taquigraficas/-/notas/r/9995
9995,2021-05-18,9, Otto Alencar,PSD - BA,"– Mas, depois que saiu do Governo, começou a bater no Governo. Inclusive, aqui, numa matéria também, o senhor diz textualmente: ""O Governo minguou"". O Governo minguou. Nem com o Presidente o senhor teve uma diplomacia, porque não precisava sair batendo, não é? Sair batendo no Presidente, serviu a ele tanto tempo, foi tão submisso ao Presidente, a ponto de, numa churrascaria, num jantar com cantores sertanejos, o Presidente agredir a imprensa com palavras de baixo calão – que eu não digo nem sozinho, imagine numa churrascaria –, o senhor bater palma, e eu fiquei preocupada de o senhor quebrar a mão de tanto bater palma para o Presidente quando ele xingou a imprensa! E fica depois criticando o Governo! Esta matéria aqui é só crítica ao Governo o tempo inteiro: que era um Governo que negou, que ia fazer uma transformação que não fez, que ia resolver o problema, mas não, se submeteu ao sistema, se submeteu ao chamado centrão na Câmara dos Deputados... Enfim, é uma mudança tão radical, quase uma transformação grande! Mudar de cor de uma hora para outra assim... Mudar a pelagem e começar a bater no Governo não é próprio de um chanceler que tenha altivez, consciência, formação e não seja nem submisso nem também depois ingrato ao próprio Presidente da República! E olhe que eu discordo completamente da política de saúde do Presidente. Eu não personalizo, não! Eu discuto aqui as questões importantes.",https://www25.senado.leg.br/web/atividade/notas-taquigraficas/-/notas/r/9995
9995,2021-05-18,9, Otto Alencar,PSD - BA,"Quando eu vejo mesmo alguém dizer – como disse o Presidente, e o senhor também disse – ""comunavírus"", querendo atribuir que a China fez o vírus em laboratório, é de uma ignorância sem par! Ministro, até hoje, a ciência não conhece o hospedeiro intermediário do coronavírus, não tem a previsão de qual é o hospedeiro intermediário. Quando o coronavírus surgiu na Ásia Menor... O senhor sabe quando foi que aconteceu? Não sabe. Foi em 2012, o que foi chamado de a Síndrome Respiratória do Oriente Médio, causada por um tipo de coronavírus, o Mers, o MERS-COV, porque tem sete tipos de coronavírus agressivos. Pois bem. Quando surgiu lá, se pensava que era no camelo; na China, se achava que era o rato de bambu, que os chineses usam na alimentação, ou uma parte dos chineses; depois, se pensou que era o morcego; depois, se pensou que era o pangolim. Como é que vai dizer que o vírus foi feito em laboratório? A China é um país que precisa ser respeitado do ponto de vista tecnológico, da ciência, que está oferecendo a nós aqui o insumo farmacológico ativo para produzir a CoronaVac. Então, todas essas declarações foram quando o senhor estava no Governo para agradar e incensar o Presidente da República! Portanto, é preciso corrigir essa falta de verdade, essa briga permanente contra a verdade dos fatos, da ciência na sua integralidade, da honestidade do médico no tratamento com as pessoas.",https://www25.senado.leg.br/web/atividade/notas-taquigraficas/-/notas/r/9995
9995,2021-05-18,9, Otto Alencar,PSD - BA,"Eu nunca vi na minha vida, nunca pensei – médico que sou, como o meu amigo aqui, Rogério Carvalho, o Senador Humberto Costa – que o meu País tivesse tanta vaga para charlatão, medicando medicamento que não tem eficácia nenhuma para a doença, tipo hidroxicloroquina, e outros também, em que são levados à população o risco de ter problemas muito graves, inclusive complicações até para levar os pacientes a óbito.",https://www25.senado.leg.br/web/atividade/notas-taquigraficas/-/notas/r/9995
9995,2021-05-18,9, Otto Alencar,PSD - BA,"Portanto, Sr. Presidente, agradeço a V. Exa., e não esperava essa transformação tão grande do ex-Chanceler Ernesto Araújo.",https://www25.senado.leg.br/web/atividade/notas-taquigraficas/-/notas/r/9995
9995,2021-05-18,9, Otto Alencar,PSD - BA,Muito obrigado.,https://www25.senado.leg.br/web/atividade/notas-taquigraficas/-/notas/r/9995
9995,2021-05-18,9, Eduardo Girão,Bloco Parlamentar PODEMOS/PSDB/PSL/PODEMOS - CE,– Sr. Presidente...,https://www25.senado.leg.br/web/atividade/notas-taquigraficas/-/notas/r/9995
9995,2021-05-18,9, Presidente,Omar Aziz. PSD - AM,"– ... Júlio, do Estado do Piauí.",https://www25.senado.leg.br/web/atividade/notas-taquigraficas/-/notas/r/9995
9995,2021-05-18,9, Presidente,Omar Aziz. PSD - AM,"O Piauí foi o primeiro Estado que abriu os braços para receber pacientes do Amazonas, e a gente é muito grato – viu, Júlio? – ao Estado do Piauí e ao povo do Piauí. Muito obrigado pela solidariedade que vocês tiveram com o Amazonas, no momento mais difícil que a gente passou. Muito obrigado.",https://www25.senado.leg.br/web/atividade/notas-taquigraficas/-/notas/r/9995
9995,2021-05-18,9, Leila Barros,Bloco Parlamentar Senado Independente/PSB - DF,"– Sr. Presidente... Só pela ordem, só...",https://www25.senado.leg.br/web/atividade/notas-taquigraficas/-/notas/r/9995
9995,2021-05-18,9, Presidente,Omar Aziz. PSD - AM,– O Senador Eduardo Girão...,https://www25.senado.leg.br/web/atividade/notas-taquigraficas/-/notas/r/9995
9995,2021-05-18,9, Eduardo Girão,Bloco Parlamentar PODEMOS/PSDB/PSL/PODEMOS - CE,– É rapidamente o meu...,https://www25.senado.leg.br/web/atividade/notas-taquigraficas/-/notas/r/9995
9995,2021-05-18,9, Presidente,Omar Aziz. PSD - AM,"– Só um minutinho, Senadora Leila.",https://www25.senado.leg.br/web/atividade/notas-taquigraficas/-/notas/r/9995
9995,2021-05-18,9, Eduardo Girão,Bloco Parlamentar PODEMOS/PSDB/PSL/PODEMOS - CE. Pela ordem.,"– ... minha irmã querida, Leila.",https://www25.senado.leg.br/web/atividade/notas-taquigraficas/-/notas/r/9995
9995,2021-05-18,9, Eduardo Girão,Bloco Parlamentar PODEMOS/PSDB/PSL/PODEMOS - CE. Pela ordem.,"É só para fazer aqui um contraponto ao Senador Otto Alencar, que disse que eu faltei com a verdade na pergunta que eu fiz ao nosso ex-Ministro Ernesto Araújo, quando eu falei, através da pergunta, que o Brasil vacinou. Isso é fato, isso é dado que está na mídia. O Brasil vacinou 58.686.976 pessoas. É o total do Consórcio de Imprensa. No mundo, a China...",https://www25.senado.leg.br/web/atividade/notas-taquigraficas/-/notas/r/9995
9995,2021-05-18,9, Otto Alencar,PSD - BA,"– Senador Girão, vale a primeira e a segunda dose. Seja honesto. Vale a primeira e a segunda dose.",https://www25.senado.leg.br/web/atividade/notas-taquigraficas/-/notas/r/9995
9995,2021-05-18,9, Eduardo Girão,Bloco Parlamentar PODEMOS/PSDB/PSL/PODEMOS - CE,"– O senhor falou que isso dava 9%, e isso dá quase 15.",https://www25.senado.leg.br/web/atividade/notas-taquigraficas/-/notas/r/9995
9995,2021-05-18,9, Otto Alencar,PSD - BA,– A primeira e a segunda dose não chegaram a 10...,https://www25.senado.leg.br/web/atividade/notas-taquigraficas/-/notas/r/9995
9995,2021-05-18,9, Eduardo Girão,Bloco Parlamentar PODEMOS/PSDB/PSL/PODEMOS - CE,"– Agora, eu vou dizer uma coisa: charlatão... Charlatão é quando a gente coloca certas coisas...",https://www25.senado.leg.br/web/atividade/notas-taquigraficas/-/notas/r/9995
9995,2021-05-18,9, Otto Alencar,PSD - BA,– O senhor botou a carapuça na cabeça.,https://www25.senado.leg.br/web/atividade/notas-taquigraficas/-/notas/r/9995
9995,2021-05-18,9, Eduardo Girão,Bloco Parlamentar PODEMOS/PSDB/PSL/PODEMOS - CE,"– Não, não, não, negativo...",https://www25.senado.leg.br/web/atividade/notas-taquigraficas/-/notas/r/9995
9995,2021-05-18,9, Otto Alencar,PSD - BA,– Botou a carapuça na cabeça.,https://www25.senado.leg.br/web/atividade/notas-taquigraficas/-/notas/r/9995
9995,2021-05-18,9, Eduardo Girão,Bloco Parlamentar PODEMOS/PSDB/PSL/PODEMOS - CE,– Negativo.,https://www25.senado.leg.br/web/atividade/notas-taquigraficas/-/notas/r/9995
9995,2021-05-18,9, Otto Alencar,PSD - BA,– O senhor está receitando aí?,https://www25.senado.leg.br/web/atividade/notas-taquigraficas/-/notas/r/9995
9995,2021-05-18,9, Eduardo Girão,Bloco Parlamentar PODEMOS/PSDB/PSL/PODEMOS - CE,"– Quando o senhor coloca que tem gente que morre com medicamentos que existem há décadas, o senhor está sendo mentiroso.",https://www25.senado.leg.br/web/atividade/notas-taquigraficas/-/notas/r/9995
9995,2021-05-18,9, Otto Alencar,PSD - BA,"– Mentiroso, não. O senhor me respeite.",https://www25.senado.leg.br/web/atividade/notas-taquigraficas/-/notas/r/9995
9995,2021-05-18,9, Eduardo Girão,Bloco Parlamentar PODEMOS/PSDB/PSL/PODEMOS - CE,– O senhor está sendo mentiroso...,https://www25.senado.leg.br/web/atividade/notas-taquigraficas/-/notas/r/9995
9995,2021-05-18,9, Otto Alencar,PSD - BA,"– Mentiroso, não. Eu estou dizendo que a medicação...",https://www25.senado.leg.br/web/atividade/notas-taquigraficas/-/notas/r/9995
9995,2021-05-18,9, Eduardo Girão,Bloco Parlamentar PODEMOS/PSDB/PSL/PODEMOS - CE,"– ... porque aqui nós fizemos, no Plenário do Senado Federal...",https://www25.senado.leg.br/web/atividade/notas-taquigraficas/-/notas/r/9995
9995,2021-05-18,9, Eduardo Girão,Bloco Parlamentar PODEMOS/PSDB/PSL/PODEMOS - CE,"– Ivermectina e cloroquina não têm morte, não. Vamos ouvir os cientistas.",https://www25.senado.leg.br/web/atividade/notas-taquigraficas/-/notas/r/9995
9995,2021-05-18,9, Otto Alencar,PSD - BA,"– Certamente, hoje de manhã V. Exa. se olhou no espelho, sabe que é mentiroso é quer colocar em mim.",https://www25.senado.leg.br/web/atividade/notas-taquigraficas/-/notas/r/9995
9995,2021-05-18,9, Eduardo Girão,Bloco Parlamentar PODEMOS/PSDB/PSL/PODEMOS - CE,"– É, mas aí o senhor está incomodado porque eu estou querendo ver o Consórcio do Nordeste. O senhor está incomodado porque eu estou querendo ver o que que está acontecendo na Bahia.",https://www25.senado.leg.br/web/atividade/notas-taquigraficas/-/notas/r/9995
9995,2021-05-18,9, Otto Alencar,PSD - BA,"– Não, não estou, não.",https://www25.senado.leg.br/web/atividade/notas-taquigraficas/-/notas/r/9995
9995,2021-05-18,9, Eduardo Girão,Bloco Parlamentar PODEMOS/PSDB/PSL/PODEMOS - CE,– Mas nós vamos ver.,https://www25.senado.leg.br/web/atividade/notas-taquigraficas/-/notas/r/9995
9995,2021-05-18,9, Otto Alencar,PSD - BA,"– Vamos ver, claro.",https://www25.senado.leg.br/web/atividade/notas-taquigraficas/-/notas/r/9995
9995,2021-05-18,9, Eduardo Girão,Bloco Parlamentar PODEMOS/PSDB/PSL/PODEMOS - CE,– O povo brasileiro quer ver. Ande nas ruas da sua cidade para ver se eles não querem...,https://www25.senado.leg.br/web/atividade/notas-taquigraficas/-/notas/r/9995
9995,2021-05-18,9, Otto Alencar,PSD - BA,"– A gente vê sim, claro que vamos ver...",https://www25.senado.leg.br/web/atividade/notas-taquigraficas/-/notas/r/9995
9995,2021-05-18,9, Presidente,Omar Aziz. PSD - AM,– Será que a gente não vai ter uma sessão sem a gente ter que se desgastar?,https://www25.senado.leg.br/web/atividade/notas-taquigraficas/-/notas/r/9995
9995,2021-05-18,9, Otto Alencar,PSD - BA,"– Prescrever medicação, sem ser médico, é charlatão mesmo!",https://www25.senado.leg.br/web/atividade/notas-taquigraficas/-/notas/r/9995
9995,2021-05-18,9, Eduardo Girão,Bloco Parlamentar PODEMOS/PSDB/PSL/PODEMOS - CE,– Quem que está prescrevendo? Quem que está prescrevendo aqui?,https://www25.senado.leg.br/web/atividade/notas-taquigraficas/-/notas/r/9995
9995,2021-05-18,9, Otto Alencar,PSD - BA,"– V. Exa., a toda hora...",https://www25.senado.leg.br/web/atividade/notas-taquigraficas/-/notas/r/9995
9995,2021-05-18,9, Eduardo Girão,Bloco Parlamentar PODEMOS/PSDB/PSL/PODEMOS - CE,"– Não, eu defendo a autonomia médica! Eu defendo a autonomia médica! Absolutamente...",https://www25.senado.leg.br/web/atividade/notas-taquigraficas/-/notas/r/9995
9995,2021-05-18,9, Otto Alencar,PSD - BA,"– Amanheceu o dia, olhou-se no espelho, sabe que é mentiroso e quer colocar em mim...",https://www25.senado.leg.br/web/atividade/notas-taquigraficas/-/notas/r/9995
9995,2021-05-18,9, Eduardo Girão,Bloco Parlamentar PODEMOS/PSDB/PSL/PODEMOS - CE,"– Não, aí você está sendo agressivo. Eu não vou entrar na sua... Eu não vou entrar.",https://www25.senado.leg.br/web/atividade/notas-taquigraficas/-/notas/r/9995
9995,2021-05-18,9, Presidente,Omar Aziz. PSD - AM,"– Com a palavra, Senador Randolfe.",https://www25.senado.leg.br/web/atividade/notas-taquigraficas/-/notas/r/9995
9995,2021-05-18,9, Otto Alencar,PSD - BA. Fora do microfone.,– E me respeite.,https://www25.senado.leg.br/web/atividade/notas-taquigraficas/-/notas/r/9995
9995,2021-05-18,9, Presidente,"c""Omar Aziz. PSD - AM"", ""Pausa.""",Omar Aziz. PSD - AM – Senador Randolfe... Pausa.,https://www25.senado.leg.br/web/atividade/notas-taquigraficas/-/notas/r/9995
9995,2021-05-18,9, Presidente,"c""Omar Aziz. PSD - AM"", ""Pausa.""",Senador Randolfe...,https://www25.senado.leg.br/web/atividade/notas-taquigraficas/-/notas/r/9995
9995,2021-05-18,9, Leila Barros,Bloco Parlamentar Senado Independente/PSB - DF. Pela ordem.,"– Sr. Presidente, é rapidinho, é só uma pergunta: eu gostaria de saber a lista de oradores, só para a gente se organizar aqui, por favor.",https://www25.senado.leg.br/web/atividade/notas-taquigraficas/-/notas/r/9995
9995,2021-05-18,9, Presidente,Omar Aziz. PSD - AM,"– ... Desculpa... Vem, depois do Senador Randolfe, o Senador Eduardo Braga. Logo após, vêm os inscritos suplentes, que, na ordem, são: o Senador Rogério Carvalho; o Senador Angelo Coronel, de forma remota; Senadora Mara Gabrilli, que vai pela Bancada Feminina, segundo está escrito aqui; Senador Alessandro Vieira; Senador Fernando Bezerra; e Senador Luis Carlos Heinze, inscritos como suplentes. O.k., Senadora?",https://www25.senado.leg.br/web/atividade/notas-taquigraficas/-/notas/r/9995
9995,2021-05-18,9, Leila Barros,Bloco Parlamentar Senado Independente/PSB - DF,– Perfeito. E os não membros da CPI? Só para saber se tem uma lista... Se tem uma lista... É porque me inscrevi.,https://www25.senado.leg.br/web/atividade/notas-taquigraficas/-/notas/r/9995
9995,2021-05-18,9, Presidente,Omar Aziz. PSD - AM,"– Devo ter. Vou já... Eu digo já, já, para a senhora, Senadora.",https://www25.senado.leg.br/web/atividade/notas-taquigraficas/-/notas/r/9995
